{"authority_effect":"none","bundle_ref":"world-export:3441ad7a6ea98caa36ddb1b52c472d011564763576a4e80874ba37b4517ab7be","nexus_export_schema":"nexus-persistent-world-export/1","nexus_world_policy":"nexus-persistent-world/1","object_refs":["object:93df6664703bba63da61f0bdbf91c4210dc8e98d179ec1a12846b228cb493289","object:75f478787d916663674c6f3cb362e9d4e8b60630c4e3dc3bb668e3fb6a6dacec","object:a680b653ba7d96b04603334c56a0726272c4b70bf4224c6d4c1f1ad3b65d88ab"],"order_basis":"memory_insertion_order","schema":"qsol-fed-nexus-world-source/1","source_head_ref":null}
